777,B001FKQQDO,A2TN9C5E4A0I3F,Jimmy,0,0,3,1345161600,Where are the cranberries?,Bought this at a local specialty-item store because I adore chutney.  Because of the higher price and being sold like a gourmet item I wrongly thought it would be better than the affordable brands sold at the supermarket.  Wrong.  It is mostly gel (jelly) with a few fruits sprinkled throughout and tastes like cheap thickened jelly you put on sandwiches...I've had much better and that's just talking about the supermarket brands.  Very disappointed.  Money does not buy quality.,bought local specialtyitem store adore chutney higher price sold like gourmet item wrongly thought would better affordable brand sold supermarket wrong mostly gel jelly fruit sprinkled throughout taste like cheap thickened jelly put sandwichesive much better thats talking supermarket brand disappointed money buy quality,0.044444444,"[0.0, 0.0, 0.0, 0.0, 0.0, 0.8810137718481411, 0.0, 0.0, 0.0, 0.4730906190297071]"
778,B000WFM204,A2NH6AZFB199O1,DocBeiter,0,0,5,1329955200,Our ferret loves this...,"Our ferret loves this rabbit; it's a nice high protein treat in addition to his regular Evo ferret diet. The price was reasonable compared to our local pet store, which doesn't often have this item in stock.",ferret love rabbit nice high protein treat addition regular evo ferret diet price reasonable compared local pet store doesnt often item stock,0.243333333,"[0.0, 0.0, 0.0, 0.0, 0.0, 0.0, 1.0, 0.0, 0.0, 0.0]"
779,B007ZENY5W,AQZ9FQYW60HJ4,Home schooler,1,1,5,1339718400,Fantastic!,"My son made this.  He didn't have the patience to be precise about the water temperature and when, half an hour before it was done, it appeared not to have risen at all--I feared for the worse.  Determined to be polite, I agreed to have a sandwich using the bread.  It was amazing.  Apparently it rises during the baking or something.<br /><br />Great tangy flavor (perfect for a meat sandwich imho) and not heavy at all.  Fortunately we had lots of deli meats, since the whole loaf disappeared within the hour.<br /><br />We've had all but the sourdough peasant bread so far; I'm sure that will be delicious as well.",son made didnt patience precise water temperature half hour done appeared risen alli feared worse determined polite agreed sandwich using bread amazing apparently rise baking somethingbr br great tangy flavor perfect meat sandwich imho heavy fortunately lot deli meat since whole loaf disappeared within hourbr br weve sourdough peasant bread far im sure delicious well,0.329487179,"[0.8332656094018883, 0.0, 0.3964386362683992, 0.0, 0.3853632466410772, 0.0, 0.0, 0.0, 0.0, 0.0]"
780,B002ONIVX4,A2AZIBY2PKLW96,LuvBeingAMommy75,0,0,5,1283212800,Great little treats,"These were great - just as described. Used them for a bee-themed party, and now we use them as ""to go"" packs of honey for our coffee and tea.",great described used beethemed party use go pack honey coffee tea,0.8,"[0.0, 0.7825944996212322, 0.0, 0.0, 0.6225318057437653, 0.0, 0.0, 0.0, 0.0, 0.0]"
781,B002GUWBMC,A2J0QB01UVSH0Q,Trishelle Duncan,0,1,1,1328400000,NOT edible!,This is NOT Disco Dust which is edible and made for baking. DO NOT purchase this product for such purposes!,disco dust edible made baking purchase product purpose,0,"[0.0, 0.0, 0.0, 0.0, 0.0, 0.0, 0.0, 0.0, 1.0, 0.0]"
782,B0018DQFPC,A2CYNULOBYISAZ,Angel L. Maki,3,3,3,1262995200,speedy shipping,I was very happy with the quick shipping as i needed it for a school product for my daughter but when it came in the roof was broken and the corner of the house was broken. I couldn't send it back as i needed for a project.,happy quick shipping needed school product daughter came roof broken corner house broken couldnt send back needed project,0.066666667,"[0.0, 0.0, 0.0, 0.0, 0.0, 0.0, 0.0, 0.0, 1.0, 0.0]"
783,B0018DQFPC,A36MP37DITBU6F,"Enchanted  In  Dixie ""Enchanted""",3,3,4,1247875200,"My sons 9 & 11 loved making this, as easy enough to do by themselves. With adult supervision any age can do this neat project.","Really easy project for family fun anytime not just for Christmas. Just put icing between cookies and stack. Then ice outside and decorate. Great for all ages. Strawberry licorice rope looks like stuck together but just find end and unwind.<br /><br />* CAUTION UNDER 3** Small hard candy decorations swallowing hazard.<br /><br />Comes with everything you need except bowls an spoons.<br />contains :<br />cookie pieces<br />Large bag yellow colored icing ( East to mix with just fork, you add water slowly as to not get to thin)<br />small white icing bag (you add water slowly)<br />green color to add to small amount of white<br />3 clear decorator<br />4 plastic decorator tips ( can save to reuse)<br />small bead candy for decoration 9chokign hazard)<br />strawberry licorice rope<br />1 small tube of orange writing icing<br />Hard candy wreath decoration about 2"" diameter<br />Gummy Spongebob about 4"" tall<br />Gummy Patrick about 4"" tall<br /><br />Icing set up hard so when you go to eat  it has to be pried apart in pieces. Cookies do get a little softer in the middle.<br /><br />Make anytime of year. Leave off wreat and Patrick and cut out Spongebob's head so does not look like chirstmas.",really easy project family fun anytime christmas put icing cooky stack ice outside decorate great age strawberry licorice rope look like stuck together find end unwindbr br caution small hard candy decoration swallowing hazardbr br come everything need except bowl spoonsbr contains br cookie piecesbr large bag yellow colored icing east mix fork add water slowly get thinbr small white icing bag add water slowlybr green color add small amount whitebr clear decoratorbr plastic decorator tip save reusebr small bead candy decoration chokign hazardbr strawberry licorice ropebr small tube orange writing icingbr hard candy wreath decoration diameterbr gummy spongebob tallbr gummy patrick tallbr br icing set hard go eat pried apart piece cooky get little softer middlebr br make anytime year leave wreat patrick cut spongebobs head look like chirstmas,-0.050783208,"[0.9364213096578338, 0.0, 0.0, 0.0, 0.1732280089527067, 0.3051347042422221, 0.0, 0.0, 0.0, 0.0]"
784,B0018DQFPC,AEC3FERY6U28I,BigCityLady,1,1,4,1293408000,Spongetastic!,My son is a SB fanatic so I was so excited to find this for the 2010 holiday season as every year we do some version of gingerbread. I knew by reading reviews that there wouldn't be enough yellow frosting so I whipped up so edible glue (water and confectionery sugar) to hold the levels of gingerbread that make the pineapple and save the yellow frosting for the outside - this worked great. It was a really fun idea that we enjoyed creating. The licorice was worthless though...,son sb fanatic excited find holiday season every year version gingerbread knew reading review wouldnt enough yellow frosting whipped edible glue water confectionery sugar hold level gingerbread make pineapple save yellow frosting outside worked great really fun idea enjoyed creating licorice worthless though,0.0875,"[0.0, 0.0, 0.0, 0.0, 1.0, 0.0, 0.0, 0.0, 0.0, 0.0]"
785,B0018DQFPC,A5EQO6GVEIT4M,lazylana05,1,1,2,1291852800,not as easy as it looks,"this isn't as easy as it looks, doesn't came with enough yellow frosting, and the frosting doesn't stick very well. My 5 year old did like making it though.",isnt easy look doesnt came enough yellow frosting frosting doesnt stick well year old like making though,0.133333333,"[0.0, 0.0, 0.0, 0.0, 0.0, 1.0, 0.0, 0.0, 0.0, 0.0]"
786,B0018DQFPC,A18OUU4I29BU9F,"Jennifer L. Eidsvold ""ShaylaRed""",2,3,1,1262649600,Not one but twice came broken.,"I am a preschool teacher and do a G is for Gingerbread unit every January. I was on vacation during Christmas and when I got back not a gingerbread kit was to be found. Which is odd. I needed one for my preschool class and needed it in less then a week. I looked everywhere and could not find ont. So I had one overnighted from Amazon on NYE and it came yesterday. I pick this one because of the Rudolph theme. The gingerbread itself came broken. Like unable to use would need a glue gun to get it to work broken. It's non returnable. I called Amazon, they were nice enough to order me a second one since I spend a ton of money each year with them. This one also came broken. I order A LOT from Amazon and things do not come broken. I think only one time have I had returned something because it was broken in 100's of orders. But two of the same thing in a row?! I think it's the kit itself and nothing to do with how it was shipped. I will say most come UPS and overnight comes Fed Ed. But it's bubble wrapped very well. I think the gingerbread isn't good and cracks in shipping and breaks off. The rest of the kit is very cute. The first kit the candies had spilled out and where a mess in the box. But the second kit while the gingerbread was all broken up again the candies were all in their bags. Too bad. But I would try something else, stay away from this one.",preschool teacher g gingerbread unit every january vacation christmas got back gingerbread kit found odd needed one preschool class needed le week looked everywhere could find ont one overnighted amazon nye came yesterday pick one rudolph theme gingerbread came broken like unable use would need glue gun get work broken non returnable called amazon nice enough order second one since spend ton money year one also came broken order lot amazon thing come broken think one time returned something broken order two thing row think kit nothing shipped say come ups overnight come fed ed bubble wrapped well think gingerbread isnt good crack shipping break rest kit cute first kit candy spilled mess box second kit gingerbread broken candy bag bad would try something else stay away one,-0.105092593,"[0.0, 0.0, 0.0, 0.13439062982061584, 0.0, 0.12483874933064235, 0.0, 0.9830332879826499, 0.0, 0.0]"
787,B0018DQFPC,A13HTFH4ZY0NCE,NatalieVee,0,0,5,1291161600,Rudolph Gingerbread House,"I was pleasantly surprised to find this item had been delivered the day after my order, my speediest delivery to date. It probably helps my location is near. Everything looks just as described and pictured and I'm very happy to have done business with this seller. The Gingerbread house was carefully packaged as not to harm the fragile pieces inside. I'm excited to give this item as a gift.",pleasantly surprised find item delivered day order speediest delivery date probably help location near everything look described pictured im happy done business seller gingerbread house carefully packaged harm fragile piece inside im excited give item gift,0.2125,"[0.0, 0.0, 0.0, 0.0, 0.0, 0.0, 0.0, 0.0, 0.0, 0.0]"
788,B0018DQFPC,AAX6FRNBEU9PK,"Susan Clinton ""gammer""",0,0,4,1289865600,Fun to paint,"These cookies were fun to paint but not too tasty to eat!<br />The kids did not really care much, but it might have been<br />more fun if they could have eaten them.<br /><br />They really had fun coloring them!",cooky fun paint tasty eatbr kid really care much might beenbr fun could eaten thembr br really fun coloring,0.26,"[1.0, 0.0, 0.0, 0.0, 0.0, 0.0, 0.0, 0.0, 0.0, 0.0]"
789,B0018DQFPC,A3111G3DOYIV2A,BB,1,2,2,1290211200,disappointment,"I was disappointed in this product because I thought it would be bigger.<br />Also, it did not come with enough icing. I had to use my own.",disappointed product thought would biggerbr also come enough icing use,-0.375,"[0.0, 0.0, 0.0, 0.0, 0.0, 0.0, 0.0, 0.0, 1.0, 0.0]"
790,B0018DQFPC,A3JO81AUCLO2U7,Sara_Aiden,1,2,2,1290038400,Cute Item... but expired!,"The whole idea of a Spongebob Ginger Bread Pineapple is really great, but the sticker that says ""Use By"" Has a 10 JN 16 date on it. If thats 2010- this is not good! I think it would be fun to make and a cute decoration, but my son is going to want to eat it.  The least the seller could do is to check the expiration date! Its right on the front of the box! Not happy at all!!!",whole idea spongebob ginger bread pineapple really great sticker say use jn date thats good think would fun make cute decoration son going want eat least seller could check expiration date right front box happy,0.410714286,"[0.0, 0.0, 0.0, 0.6880318329792324, 0.7256805060129683, 0.0, 0.0, 0.0, 0.0, 0.0]"
791,B000UZMJZO,A2V71J7J3DTB5B,Vehred,2,3,1,1196121600,If I could give a rating under one-star...,"This tea carries the flavor one would expect from the smell: terrible.  It invigorates like a puncture wound, and the only revival is that, after drinking, you discover that you are still alive.<br /><br />Well, one tea bag was enough for me.  My mother-in-law said, ""Oh, that smells kind of like wine.""  Okay, kind of like wine, with a hint of rot and a moldy aftertaste.  If she likes it, she can have the whole box.",tea carry flavor one would expect smell terrible invigorates like puncture wound revival drinking discover still alivebr br well one tea bag enough motherinlaw said oh smell kind like wine okay kind like wine hint rot moldy aftertaste like whole box,0.15,"[0.2509234298097657, 0.0, 0.23876118538715604, 0.0, 0.0, 0.817638874220234, 0.0, 0.45988824739157225, 0.0, 0.0]"
792,B000UZMJZO,A31WPNRPB608EC,"D. Clark ""Auroresand""",1,2,1,1265500800,Horrid,"If it were possible to give this product zero stars, I would have done so.  I am a huge fan of Twinings teas, and was very excited to try this new blend.  After arriving home from the grocery, I immediately started the kettle to enjoy a cup while prepping dinner.  Between sorting, washing, and chopping items, the hot water was added to the bag to steep.  Preparation continued, until a distinctly off odor hit me.  I thought one of my ingredients must be rancid!  I hunted around for almost four minutes before I realized it was the tea.  Even after cleaning up, and airing out the kitchen, my roommate later came in and asked about the smell.  Save your money to purchase ANY other Twinings product.",possible give product zero star would done huge fan twinings tea excited try new blend arriving home grocery immediately started kettle enjoy cup prepping dinner sorting washing chopping item hot water added bag steep preparation continued distinctly odor hit thought one ingredient must rancid hunted around almost four minute realized tea even cleaning airing kitchen roommate later came asked smell save money purchase twinings product,0.232670455,"[0.0, 0.0, 0.0, 0.0, 0.0, 0.0, 0.0, 0.432684058255781, 0.9015456204382049, 0.0]"
793,B000UZMJZO,A1KG9W0FX5STMR,Emiliy Marino,1,2,4,1209254400,delicious,"This tea is the best tea i've ever had. i first tasted it in norway, and had to find it in the states. i have it every morning.",tea best tea ive ever first tasted norway find state every morning,0.625,"[0.0, 0.0, 0.0, 0.0, 0.0, 0.0, 0.0, 0.0, 0.0, 0.0]"
794,B000UZMJZO,AZ3FPU1QSFBC6,annifree,0,1,5,1299974400,I love this tea - to each her own taste buds!,"I love the aroma and the taste of the fruit and vanilla combo, and the addition of ginseng for an added energy boost rounds this tea out nicely for me. It's a sweet tea, which makes it a wonderful healthy alternative to desert after dinner.<br /><br />I see that others didn't like it, but it's really a matter of personal taste...different courses for different horses!",love aroma taste fruit vanilla combo addition ginseng added energy boost round tea nicely sweet tea make wonderful healthy alternative desert dinnerbr br see others didnt like really matter personal tastedifferent course different horse,0.29375,"[0.5520074839011347, 0.0, 0.0, 0.0, 0.0, 0.4496817794578284, 0.5097440198555417, 0.0, 0.0, 0.48294416774850135]"
795,B00285FF6O,A2S244KFX0745K,Alan Edward Creager,3,3,5,1285718400,There is none greater.,"The best chocolate in the world, in this critic's humble opinion, is made in the United States. And the best chocolate in the United States is made in California, by the Ghirardelli Chocolate Company. It is surely the best chocolate that one can find in so many stores, malls, etc. throughout the United States. Their actual stores are rare, but Kroger, Wal-Mart, Martin's (formerly Ukrops) and a long list of other grocery stores and many malls stock their products.<br /><br />I have never encountered milk chocolates with caramel filling to surpass the quality of these. These are chocolates deserving of poetry. You can eat them quickly, or take your time and savor every moment of eating every one. The choice is up to you.",best chocolate world critic humble opinion made united state best chocolate united state made california ghirardelli chocolate company surely best chocolate one find many store mall etc throughout united state actual store rare kroger walmart martin formerly ukrops long list grocery store many mall stock productsbr br never encountered milk chocolate caramel filling surpass quality chocolate deserving poetry eat quickly take time savor every moment eating every one choice,0.415277778,"[0.478962894215875, 0.0, 0.0, 0.0, 0.0, 0.0, 0.0, 0.8778351473735558, 0.0, 0.0]"
796,B00285FF6O,A2FOXRMJA0T9M7,kupres,1,1,5,1285113600,Caramel chocolate,This is a good quality brand of chocolate with many flavours of which this is just one. Very tasty and a fast delivery too,good quality brand chocolate many flavour one tasty fast delivery,0.466666667,"[0.0, 0.0, 0.0, 0.6913921503135283, 0.0, 0.0, 0.0, 0.7224796844789723, 0.0, 0.0]"
797,B00285FF6O,ARXORJX86X1J2,Yvette Mendoza,0,0,5,1327017600,Chocolate heaven,"My mother and father were the recipient of these wonderful pieces of chocolate heaven.  They didn't believe they deserved receiving these, but I know they did deserve to receive these!",mother father recipient wonderful piece chocolate heaven didnt believe deserved receiving know deserve receive,1,"[0.0, 0.0, 0.0, 0.0, 0.0, 0.0, 0.0, 0.0, 0.0, 0.0]"
798,B00285FF6O,A372X206KVOQWQ,"Isehara ""isehara2""",0,0,5,1326931200,Heavenly Action,"This is the best caramel/chocolate combination I have ever tasted. The caramel is liquid and complements the Ghiradelli chocolate perfectly. Do not try this brew if you are attempting to lose weight - you will end up an addict like me.<br />  The Ghiradelli product is far better than the Caramello/Hershey product in every way. The Caramello chocolate lacks the refined taste of the Ghiradelli squares, and the Caramello caramel is harder and not as sublime in taste. Comparing the two is like comparing Warren Buffett to myself in terms of wealth. Unfortunately I am the Caramello bar in this regard.<br />  At the very least try the Ghiradelli.",best caramelchocolate combination ever tasted caramel liquid complement ghiradelli chocolate perfectly try brew attempting lose weight end addict like mebr ghiradelli product far better caramellohershey product every way caramello chocolate lack refined taste ghiradelli square caramello caramel harder sublime taste comparing two like comparing warren buffett term wealth unfortunately caramello bar regardbr least try ghiradelli,0.242857143,"[0.0, 0.0, 0.0, 0.0, 0.0, 0.5324827067788598, 0.0, 0.0, 0.6240409669044789, 0.5718697741674952]"
799,B00285FF6O,A1O4VI7N94CK4L,SpencerMom,0,0,3,1325289600,Great chocolate...,"Of course, we all know how delicious Ghirardelli chocolate is!!!! Unfortunately, after I purchased two of these gift bags online, I found them in a local store for half the price. Lesson learned???!!!",course know delicious ghirardelli chocolate unfortunately purchased two gift bag online found local store half price lesson learned,0.083333333,"[0.0, 0.0, 0.0, 0.0, 0.0, 0.0, 0.0, 0.0, 0.0, 0.0]"
800,B00285FF6O,AJTSE4IPHREL4,Aaron De Leon,0,0,5,1315526400,Great item,This chocolate treat is a great gift and it arrived right when I expected it to. I gave it to my girlfriend as a surprise gift and she absolutely loved it.,chocolate treat great gift arrived right expected gave girlfriend surprise gift absolutely loved,0.421428571,"[0.0, 0.0, 0.0, 0.0, 1.0, 0.0, 0.0, 0.0, 0.0, 0.0]"
801,B00285FF6O,AQ9M45GUGWJ9N,Susan C. Fowler,0,0,5,1276387200,choclate,the first time i ordered this it came all melted but amazon was quick to remedy the situation by sending me another of the product and it was great thank you,first time ordered came melted amazon quick remedy situation sending another product great thank,0.461111111,"[0.0, 0.0, 0.0, 0.0, 0.6958259574021662, 0.0, 0.0, 0.0, 0.718210440612888, 0.0]"
802,B00285FF6O,AXXCSX5J1YGEH,Jelly,0,1,3,1335052800,is this serious??? 10 bucks??,Are people really paying 10 bucks for these chocolates??? ummmm go to any grocery store and by them for 2.98 a bag..wow,people really paying buck chocolate ummmm go grocery store bagwow,0.2,"[0.0, 0.0, 0.0, 0.0, 0.0, 0.0, 0.0, 0.0, 0.0, 0.0]"
803,B0067R3Q9M,A35RALTOLCAJLH,"Marie C. Majumdar ""Catherine""",0,0,5,1330819200,Yum!,Low calorie and satisfying. These soups are a nice fill in when you don't want too much but don't want to be hungry for a few hours.,low calorie satisfying soup nice fill dont want much dont want hungry hour,0.325,"[0.0, 0.0, 0.0, 0.0, 0.0, 0.0, 0.0, 0.0, 0.0, 0.0]"
804,B004S0AQHA,A3AV5XEJ25KVF4,"Castlecat ""castlecat""",9,10,3,1310774400,"Overpriced, Even on Gold Box","This was really a disappointment. While the products included are fine, the real disappointment was the travel mug. It is a cheap plastic cup with the nutritional information for the cookies on it! So it is basically just a cookie package! Yeah, that is really what I want to use as a travel mug. I agree with the review that it looks like it came from a dollar store. The product description says the polka dot tumbler is ""definitely a keeper."" What? It is simply cheap packaging! Not something of quality to enjoy. Had I known that I would not have purchased the set. I really was looking forward to using the cute looking mug on a daily basis. I like the products inside and the basket is OK, but really this what not what it appeared to be.",really disappointment product included fine real disappointment travel mug cheap plastic cup nutritional information cooky basically cookie package yeah really want use travel mug agree review look like came dollar store product description say polka dot tumbler definitely keeper simply cheap packaging something quality enjoy known would purchased set really looking forward using cute looking mug daily basis like product inside basket ok really appeared,0.132051282,"[0.0, 0.0, 0.0, 0.0, 0.0, 0.49445130626641615, 0.0, 0.0, 0.8692053300178473, 0.0]"
805,B004S0AQHA,A1JYQTN8CN3CY2,JC in ABQ,9,10,3,1310428800,Even at $15 seems a little overpriced.,"It looks pretty, but the contents are very minute and seem to not be of very high quality. There's a plastic cup for the tea that looks like it came from a dollar store. The basket is nice, though.",look pretty content minute seem high quality there plastic cup tea look like came dollar store basket nice though,0.336666667,"[0.0, 0.0, 0.0, 0.0, 0.0, 1.0, 0.0, 0.0, 0.0, 0.0]"
806,B004S0AQHA,A3R66N9FR8HMJ7,Kdpsnake,2,2,5,1311120000,Quick arrival great basket!,Purchased this as a gift for my mother when it was a lightning deal.  She was very happy and loved the basket.  She enjoyed the cookies and the flavors of tea that were included.  Shipped quick and arrived when expected.,purchased gift mother lightning deal happy loved basket enjoyed cooky flavor tea included shipped quick arrived expected,0.446666667,"[0.0, 0.0, 1.0, 0.0, 0.0, 0.0, 0.0, 0.0, 0.0, 0.0]"
807,B004S0AQHA,A1ZYO3FOEXVCJS,Catherine Odegard,1,1,5,1312329600,Adorable basket-makes nice presentation,"Received very quickly and extremely well packaged.  Since this is a smaller sized basket, it would be an adorable present for anyone who likes tea, for self or just to have to hand.  Very nicely assembled with attention to detail.",received quickly extremely well packaged since smaller sized basket would adorable present anyone like tea self hand nicely assembled attention detail,0.195,"[0.0, 0.0, 0.0, 0.0, 0.0, 1.0, 0.0, 0.0, 0.0, 0.0]"
808,B0030C9A60,A3BH49ZKESHDID,Fred Camfield,1,1,5,1290038400,Specialty party item,"These small chocolate cups are a specialty party item that I have never been able to find in the past when I wanted them.  Amazon now provides a link.  They can be used for what are commonly called ""jello shots,"" and provide a solid edible alternative to small paper cups.",small chocolate cup specialty party item never able find past wanted amazon provides link used commonly called jello shot provide solid edible alternative small paper cup,-0.216666667,"[0.0, 0.0, 0.0, 0.0, 0.0, 0.0, 0.0, 0.0, 0.0, 0.0]"
809,B0030C9A60,A23WVMQ6J7BZ61,B. Rickerd,0,0,5,1334793600,Delicious!,I bought these chocolate liquor cups for a party! It was a big hit. They are high quality and a good buy.,bought chocolate liquor cup party big hit high quality good buy,0.286666667,"[0.0, 0.0, 0.0, 1.0, 0.0, 0.0, 0.0, 0.0, 0.0, 0.0]"
810,B0030C9A60,A22SF4XQI6LLUS,"Michael Mcadams ""Scout collector""",0,0,5,1326758400,Chocolate - How can you go wrong?,Great for serving Chocolate liquor. Adds a touch of class to your event and elevates you to host supreme. Being able to eat the cup afterwards is just icing on the cake.,great serving chocolate liquor add touch class event elevates host supreme able eat cup afterwards icing cake,0.65,"[0.0, 0.0, 0.0, 0.0, 1.0, 0.0, 0.0, 0.0, 0.0, 0.0]"
