1057,B001SAX7Z6,A2R81O3QF8BXI7,"ec ""marathon mommy""",0,0,5,1279411200,Great fat free and spicy!!!,"Riba foods based in Houston, Texas makes this awesome black bean dip. It is pretty much all natural and without the lard that regular refried bean dip has in it. I am not sure why in Dallas TX it's so hard to find - maybe because Riba has SO Many good flavors??? I make the traditional 7-layer dip with this instead of the refried beans, and am thinking about creating a breakfast quesadilla with this and some verde sauce. Try it, it's not too too spicy but is very good!",riba food based houston texas make awesome black bean dip pretty much natural without lard regular refried bean dip sure dallas tx hard find maybe riba many good flavor make traditional layer dip instead refried bean thinking creating breakfast quesadilla verde sauce try spicy good,0.299242424,"[0.0, 0.0, 0.4768602917503387, 0.8789791022269994, 0.0, 0.0, 0.0, 0.0, 0.0, 0.0]"
1058,B000XB80CG,A34UKAOKNIDCWZ,JJ,0,0,3,1319155200,Not exactly as described,I was expecting to receive only Starburst. When I received this it was half Skittles which I did not want or need.  I needed only Starburst.  Next time I will just go to the store.,expecting receive starburst received half skittle want need needed starburst next time go store,-0.083333333,"[0.0, 0.0, 0.0, 0.0, 0.0, 0.0, 0.0, 0.0, 0.0, 0.0]"
1059,B001GCVLXG,A3SH3ZVXS16IBL,Jeff Jones,3,3,2,1314576000,Crumbled cookies are no fun to eat,"The Good:<br /><br />Walker shortbread cookies are my favorite, I love them.  I bought the highlanders and each set of cookies came individually wrapped with two cookies each.  If this were the end of it, a five star review.<br /><br />The Bad:<br /><br />Unfortunately, Amazon shipped them in a box that was about the same size as the container they came in from the Walkers cookie company.  After UPS was through with the shipment, my cookies were reduced to crumbs.  I contacted Amazon about this problem without ever receiving a response.  Since I bought these ""Shipped and Sold by Amazon"", I won't be purchasing these cookies from Amazon again.",goodbr br walker shortbread cooky favorite love bought highlander set cooky came individually wrapped two cooky end five star reviewbr br badbr br unfortunately amazon shipped box size container came walker cookie company ups shipment cooky reduced crumb contacted amazon problem without ever receiving response since bought shipped sold amazon wont purchasing cooky amazon,0.125,"[0.9557467776795113, 0.0, 0.0, 0.0, 0.0, 0.0, 0.29419057931081144, 0.0, 0.0, 0.0]"
1060,B001GCVLXG,A1G51N43M000F7,deborahrc,1,1,5,1235520000,Heavenly!,"<a href=""http://www.amazon.com/gp/product/B001GCVLXG"">Walkers Shortbread Highlander Shortbread Portion Pack, 1.4 Ounce Units (Pack of 24)</a><br />My family loves these! It's a great 'snack' to carry in the car or it's a wonderful surprise in a lunchbag. The flavor is so rich and pure...I forgot how wonderful these shortbread cookies were. And the price is nice, too...as well as Amazon.com. I love this place!",href shortbread highlander shortbread portion pack ounce unit pack abr family love great snack carry car wonderful surprise lunchbag flavor rich purei forgot wonderful shortbread cooky price nice tooas well amazoncom love place,0.682142857,"[0.0, 0.0, 0.41840643972319314, 0.0, 0.406717330946778, 0.0, 0.812106559452447, 0.0, 0.0, 0.0]"
1061,B001GCVLXG,A1OR3IQK8AB72I,Kathleen A. Erbes-Mrsny,0,0,5,1335052800,Nicely packaged for a serving,"Walker's Highlanders are my favorite purchased cookie, so it was great to find them pre-packaged into 2 biscuits. Keeps them fresh longer and limits my snacking!",walker highlander favorite purchased cookie great find prepackaged biscuit keep fresh longer limit snacking,0.533333333,"[0.0, 0.0, 0.0, 0.0, 1.0, 0.0, 0.0, 0.0, 0.0, 0.0]"
1062,B001GCVLXG,A21V8AYNDN7TNK,Jetz45,0,0,5,1250467200,Yummy!,"If you like Shortbread you will really like these. Walkers always makes the best Shortbread.<br /><a href=""http://www.amazon.com/gp/product/B001GCVLXG"">Walkers Shortbread Highlander Shortbread Portion Pack, 1.4 Ounce Units (Pack of 24)</a>",like shortbread really like walker always make best shortbreadbr href shortbread highlander shortbread portion pack ounce unit pack,0.6,"[0.0, 0.0, 0.0, 0.0, 0.0, 1.0, 0.0, 0.0, 0.0, 0.0]"
1063,B001GCVLXG,AXA2AK79YLGEN,ladypen,3,5,1,1284163200,cookies were in crumbles,"My cookies were in such tiny broken pieces ,they were useless. Upon complaint, a second mailing arrived several weeks later. The cookies were again in crumbs. The cookies were packed in  a box with a pitiful single air bubble. I gave this feedback and expected some effort to improve on the packing. But no, same packaging, same useless cookies.  Having enjoyed these Highlanders in the past, it was both a disappointment and a big waste of money.",cooky tiny broken piece useless upon complaint second mailing arrived several week later cooky crumb cooky packed box pitiful single air bubble gave feedback expected effort improve packing packaging useless cooky enjoyed highlander past disappointment big waste money,-0.161428571,"[0.0, 0.0, 0.0, 0.0, 0.0, 0.0, 0.0, 0.0, 0.0, 0.0]"
1064,B001GCVLXG,A3C8ARJQBVVS30,babycat,1,2,5,1306108800,WONDERFUL COOKIES,COULDN'T FIND THESE ANYWHERE BUT ON LINE - IT WAS WORTH THE WAIT BECAUSE THEY ARE TRULLY GREAT TASTING COOKIES.,couldnt find anywhere line worth wait trully great tasting cooky,0.55,"[0.0, 0.0, 0.0, 0.0, 1.0, 0.0, 0.0, 0.0, 0.0, 0.0]"
1065,B0017ZBPTW,A1TIVD0Y3KJSCN,"lawyerwhocooks ""lawyerwhocooks""",3,3,5,1245715200,Worth the cost due to the unique flavor - my favorite sugar!,"Yes, these cubes are expensive; in fact, I almost gave them four stars for the expense.  Regardless, these sugar cubes are my favorite sugar product.  I've tried every brown sugar and cane sugar product you can find on Amazon and in your grocery store, and none of them compare to the rich, sweet, unique flavor of the brown sugar cubes by La Perruche.  Because I've tried so many brown sugar products, I believe the difference is the terroir, or the ground/land, where this sugar is grown.  La Perruche sugar cubes are made from African grown sugar; more specifically, sugar grown in Swaziland and/or the Congo.  Also, the cubes are denser than many sugar cubes.  I don't know from a scientific perspective how this is accomplished, but the cubes are not regularly sized, but are large and irregularly shaped, and heavier/sturdier than ""cut"" cubes by other producers.<br /><br />The flavor is a rich, distinct and more molasses-y flavor than other brown sugar cubes, and is somewhat darker as well.  I wish I could describe the flavor better, but it has been several months since I was able to find a somewhat affordable supply.  BTW, now that this product is being sold with free shipping via Amazon Prime, I just purchased several boxes - it is a much better deal as of the date of this review than it was a few months ago.  Recommended!",yes cube expensive fact almost gave four star expense regardless sugar cube favorite sugar product ive tried every brown sugar cane sugar product find amazon grocery store none compare rich sweet unique flavor brown sugar cube la perruche ive tried many brown sugar product believe difference terroir groundland sugar grown la perruche sugar cube made african grown sugar specifically sugar grown swaziland andor congo also cube denser many sugar cube dont know scientific perspective accomplished cube regularly sized large irregularly shaped heaviersturdier cut cube producersbr br flavor rich distinct molassesy flavor brown sugar cube somewhat darker well wish could describe flavor better several month since able find somewhat affordable supply btw product sold free shipping via amazon prime purchased several box much better deal date review month ago recommended,0.267857143,"[0.18236200498229288, 0.0, 0.6940917157422999, 0.0, 0.0, 0.0, 0.0, 0.0, 0.6964056212271327, 0.0]"
1066,B0017ZBPTW,A2E2YEN2AYNHPG,HM-Chicago-KG,0,0,5,1347840000,Best Brown Sugar Cubes,We love these sugar cubes in the office.  They aren't your grandmother's sugar cube.  They have a rugged appearance (can sugar cubes be considered rugged).  And we combine them with the white sugar cubes from La Perruche.,love sugar cube office arent grandmother sugar cube rugged appearance sugar cube considered rugged combine white sugar cube la perruche,0.25,"[0.0, 0.0, 0.0, 0.0, 0.0, 0.0, 1.0, 0.0, 0.0, 0.0]"
1067,B0017ZBPTW,A1YLU9NT0Q9H1V,MJC,0,0,4,1347580800,Perfect for Espresso,Love this for espressos...the raw sugar cube is not as sweet as the refined sugars and more rich in flavor.,love espressosthe raw sugar cube sweet refined sugar rich flavor,0.248557692,"[0.0, 0.0, 0.7176210536414176, 0.0, 0.0, 0.0, 0.6964337896531024, 0.0, 0.0, 0.0]"
1068,B0017ZBPTW,ALYF3U1ERAREB,Dan,0,0,3,1294876800,Too pricey,"It's a good idea to have raw sugar type cubes, but this was 3x the cost of granulated raw sugar",good idea raw sugar type cube x cost granulated raw sugar,0.079487179,"[0.0, 0.0, 0.0, 1.0, 0.0, 0.0, 0.0, 0.0, 0.0, 0.0]"
1069,B001QXUTLU,A39YLXXQHWKFTQ,Serenity,1,1,5,1342656000,"Superior product, GMO Free","Due to my husband's and son's inability to eat gluten, cornstarch is used very frequently in many gluten free recipes.  I am very concerned with the prolific use of GMOs in corn especially and my family's increased consumption of it.  I wanted to find an affordable GMO free cornstarch product to use in all my baking.  Rumford Natural Cornstarch is the one!  I've been using it for months now with great success & satisfaction.",due husband son inability eat gluten cornstarch used frequently many gluten free recipe concerned prolific use gmos corn especially family increased consumption wanted find affordable gmo free cornstarch product use baking rumford natural cornstarch one ive using month great success satisfaction,0.296875,"[0.0, 0.0, 0.0, 0.0, 0.5728838498129799, 0.0, 0.0, 0.5675849217599022, 0.5913133274451581, 0.0]"
1070,B001QXUTLU,AHVASC86C9VPS,One Tree in the Forest,5,11,1,1329955200,THIS IS NOT THE PRODUCT THAT I RECEIVED. THE ACTUAL PRODUCT MAY CARRY HEALTH RISKS FOR SOME COMSUMERS..,"I purchased this product because of its name, ""Rumford NATURALS Corn Starch"" (the word ""Naturals"" appears large and clear on the pictured product label). Also, the Amazon description said it was made from ""Non-Genetically Modified Corn"". The label on the product that I ACTUALLY received does NOT say Rumford NATURALS, but it is still MADE WITH Non-Genetically Modified Corn. I say ""made with"" because this product now contains more than ONE ingredient. Its ingredients are: Cornstarch, Calcium Sulfate*, and ONE of the suggested servings (1 Tblsp) contains 15% of the ""Daily Value"" of CALCIUM. That makes this product potentially a good source for dietary calcium supplementation. ON THE OTHER HAND, for persons who must restrict their calcium intake (example, some persons with kidney stones), it can pose a potential problem, even danger. Amazon provides themselves with a nice ""out"" for this. They list the following: Legal Disclaimer: ""Actual product packaging and materials may contain more and different information than what is shown on our website. We recommend that you do not rely solely on the information presented and that you always read labels, warnings, and directions before using or consuming a product."" BUT, IT IS NOT FAIR FOR AMAZON TO NOT AT LEAST LIST THE CORRECT INGREDIENTS AND PHOTO OF THE PACKAGE SO THAT YOU DO NOT HAVE TO ORDER THE PRODUCT IN ORDER TO ""READ LABELS"" AND FIND OUT WHAT YOU HAVE PURCHASED.<br /><br />I WILL NOT BUY THIS PRODUCT AGAIN:<br /> * because I don't need extra calcium<br /> * because I don't believe that the Calcium Sulfate was added out of interest in the consumer's health<br />  but to make the product cheaper to produce so it can be priced competitively with other brands<br />  and still be touted as having been made from/with Non-Genetically Modified Corn<br /> and just on principal because I can't afford to throw it away and did not want the hassle of returning it.<br /><br />I am very, very displeased with Amazon's incorrect listing of the product, which was brought to their attention when I purchased it in February 2012, and so far nothing has been done.<br /><br />*Although Calcium Sulfate is considered a safe food additive it is basically the same thing as Plaster of Paris. AND, if you use too much of this product (basically the same amount as I had previous used of pure CORN STARCH), the very stiff sediment in the bottom of the cooking container (I make pudding in Pyrex in a microwave and usually stir it only every 30 seconds) will remind you of damp plaster!",purchased product name rumford natural corn starch word natural appears large clear pictured product label also amazon description said made nongenetically modified corn label product actually received say rumford natural still made nongenetically modified corn say made product contains one ingredient ingredient cornstarch calcium sulfate one suggested serving tblsp contains daily value calcium make product potentially good source dietary calcium supplementation hand person must restrict calcium intake example person kidney stone pose potential problem even danger amazon provides nice list following legal disclaimer actual product packaging material may contain different information shown website recommend rely solely information presented always read label warning direction using consuming product fair amazon least list correct ingredient photo package order product order read label find purchasedbr br buy product againbr dont need extra calciumbr dont believe calcium sulfate added interest consumer healthbr make product cheaper produce priced competitively brandsbr still touted made fromwith nongenetically modified cornbr principal cant afford throw away want hassle returning itbr br displeased amazon incorrect listing product brought attention purchased february far nothing donebr br although calcium sulfate considered safe food additive basically thing plaster paris use much product basically amount previous used pure corn starch stiff sediment bottom cooking container make pudding pyrex microwave usually stir every second remind damp plaster,0.115904762,"[0.24967264382686954, 0.0, 0.0, 0.07298432749265213, 0.0, 0.0, 0.0, 0.15253194261719563, 0.9534520781593436, 0.0]"
1071,B004XDMS3C,A2YVSVBU5YZNQT,"Denise L. Gray ""dgray""",1,2,1,1339545600,melted!!!,Was really bummed to find out that these chocolates had melted before they got to my daughter for her bday.  Seems that they should not be sold online if there is not a way to keep them 'safe'.  :-(,really bummed find chocolate melted got daughter bday seems sold online way keep safe,0.35,"[0.0, 0.0, 0.0, 0.0, 0.0, 0.0, 0.0, 0.0, 0.0, 0.0]"
1072,B0043PU4VS,A5NZUU4AUOWZH,S. L. Endy,0,0,5,1346803200,Very Potent.,"If you love garlic, I recommend this flavored oil.  It is true to its name.  I was not expecting it to be so strong, so if I use it for cooking or dipping bread, I will mix it with some unflavored olive oil in the future.",love garlic recommend flavored oil true name expecting strong use cooking dipping bread mix unflavored olive oil future,0.320833333,"[0.0, 0.0, 0.0, 0.0, 0.0, 0.0, 1.0, 0.0, 0.0, 0.0]"
1073,B001GE3T1G,A3SIOSO6LTWCVE,Calligen Nox,7,7,5,1266537600,"Hands Down, Best Mint EVER.","These things are AWESOME. Perfect size, truly wafer thin, consistent thickness of dark chocolate over minty interior. They are like what would happen if you could run a steamroller over a junior mint. I first tried them when I was living in Germany 16 years ago, and to this day no other mint comes close. And the copycat ones? Disgusting. Go for the original. You won't regret it. Each mint is in its own sleeve, so you can pass them out without ever touching one. Elegant and delicious. Love them!",thing awesome perfect size truly wafer thin consistent thickness dark chocolate minty interior like would happen could run steamroller junior mint first tried living germany year ago day mint come close copycat one disgusting go original wont regret mint sleeve pas without ever touching one elegant delicious love,0.31875,"[0.0, 0.0, 0.0, 0.0, 0.0, 0.3689375853076161, 0.41821513879714106, 0.8300488876134184, 0.0, 0.0]"
1074,B001GE3T1G,A2DQQUEPK53ORW,handicapped shopper,1,1,5,1317600000,The BEST mint,"Love these mints.  They melt in your mouth and taste better than any others I have tried.  Just wish they weren't so expensive.  You can't eat just one, a couple.  They are addictively delicious.",love mint melt mouth taste better others tried wish werent expensive cant eat one couple addictively delicious,0.375,"[0.0, 0.0, 0.0, 0.0, 0.0, 0.0, 0.5890089035187827, 0.5845151691140874, 0.0, 0.5580416907822667]"
1075,B001GE3T1G,A2J8GOBY9PV8WG,Andrei G. Birsan,1,1,5,1282608000,delicious,I got it for my girlfriend. Very good stuff. Now everybody in the house eats them. Very hight quality if you are into chocolate and mint.,got girlfriend good stuff everybody house eats hight quality chocolate mint,0.7,"[0.0, 0.0, 0.0, 1.0, 0.0, 0.0, 0.0, 0.0, 0.0, 0.0]"
1076,B001GE3T1G,A3Q63ZZGUICVFW,Charlene Sonnenborn,0,0,5,1351123200,Impossible to Find!,"A friend's favorite candy is ""After Eight"", but they are not available anywhere in my area.  I couldn't find them on-line either.  Amazon.com came through.  These are imported from England and the most delicious peppermint.  These are so thin with a smooth mint cream center and a dark chocolate shell.  If you just want a little taste of mint, this is for you.  Really special with a cup of hot coffee!",friend favorite candy eight available anywhere area couldnt find online either amazoncom came imported england delicious peppermint thin smooth mint cream center dark chocolate shell want little taste mint really special cup hot coffee,0.206964286,"[0.0, 0.7990711395064223, 0.0, 0.0, 0.0, 0.0, 0.0, 0.0, 0.0, 0.6012364875886258]"
1077,B0035Q0N0I,A3HPCRD9RX351S,Spudman,2,2,4,1298160000,Great Ingredients,"Nature's Recipe is now a division of that mega company Del Monte Foods.<br /><br />The Test<br /><br />The neat thing about this food is that it really does look like the photograph on the bag. It consists of smallish kibble with pieces of dried carrots and peas mixed in. When the bag was first opened the girls ate small amounts of Farm Selects unmixed and readily took to it. Since then they've been eating it mixed with their Blue food.<br /><br />I thought Evie and Piper might fuss with the dried vegetables in there, but they don't specifically target the vegetables to leave behind.<br /><br />The quality of this food is obvious to one who reads the ingredient list. Only one ingredient, that animal digest, makes me cringe a little. The girls don't mind it a bit. For goodness alone I can heartily recommend this natural food, but the price on it is relatively high. Rachel Ray's dry dog food, for example, is about half the price of Farm Stands Selects, and Buffalo Blue is about the same price. For a household like ours with three dogs, the Farm Stands Selects is too pricey  to feed the girls exclusively. We'd feel obliged to mix another good, but less expensive food with it. For those with one pet and for whom money is not an issue, I say you can't go wrong with Farm Selects.",nature recipe division mega company del monte foodsbr br testbr br neat thing food really look like photograph bag consists smallish kibble piece dried carrot pea mixed bag first opened girl ate small amount farm selects unmixed readily took since theyve eating mixed blue foodbr br thought evie piper might fuss dried vegetable dont specifically target vegetable leave behindbr br quality food obvious one read ingredient list one ingredient animal digest make cringe little girl dont mind bit goodness alone heartily recommend natural food price relatively high rachel ray dry dog food example half price farm stand selects buffalo blue price household like three dog farm stand selects pricey feed girl exclusively wed feel obliged mix another good le expensive food one pet money issue say cant go wrong farm selects,-0.024254386,"[0.7700640995482239, 0.0, 0.0, 0.1688289000257906, 0.0, 0.3136586048926245, 0.0, 0.5292602050786336, 0.0, 0.0]"
1078,B0028PDGQA,A2C7PEKUF924NX,JuneTex,0,0,5,1338163200,Great price-great quality.,"You will not find a better loose green tea for the price.  I was able to get free shipping as well since I bought it with something else that totaled over $25.  This is the tea used by many Japanese people.  Do not fall for those high-priced ""organic"" green teas produced by American companies.  They are good...but you are not getting anything better than Hime Ban Cha Tea.",find better loose green tea price able get free shipping well since bought something else totaled tea used many japanese people fall highpriced organic green tea produced american company goodbut getting anything better hime ban cha tea,0.192307692,"[0.0, 0.0, 0.0, 0.0, 0.0, 0.0, 0.0, 0.0, 0.0, 0.0]"
1079,B0028PDGQA,AEJGD0907C1TJ,N. Smith,0,0,5,1316044800,Good perker-upper,"This is the favorite green tea in our household.  Been using it for years.  Was happy to find it here on Amazon, otherwise we had to travel about forty miles to an oriental grocery store to purchase it.  Can't even buy any leaf tea of any kind in regular grocery stores any more.  By the way ""Ban Cha"" in Japan simply means common or everyday tea.  Not ceremonial.",favorite green tea household using year happy find amazon otherwise travel forty mile oriental grocery store purchase cant even buy leaf tea kind regular grocery store way ban cha japan simply mean common everyday tea ceremonial,0.104166667,"[0.0, 0.0, 0.0, 0.0, 0.0, 0.0, 0.0, 0.0, 0.0, 0.0]"
1080,B0028PDGQA,A2DHG1HP5MCGMI,Jennie Kirkpatrick,0,0,5,1292803200,Excellent green tea!,"I love this tea!! It is so flavorful yet there is no cut grass or off flavor as with some green teas. It is so mild that even left steeping it does not become bitter.It has a very mellow flavor that my kids enjoy too.It's great without sweeteners.<br /> It is a loose leaf tea and when steeped the leaves unfurl,long and slender. A little tea goes a long way. Enjoy!",love tea flavorful yet cut grass flavor green tea mild even left steeping become bitterit mellow flavor kid enjoy tooits great without sweetenersbr loose leaf tea steeped leaf unfurllong slender little tea go long way enjoy,0.191891026,"[0.0, 0.0, 0.8243145562775757, 0.0, 0.4006427535049347, 0.0, 0.3999886203042375, 0.0, 0.0, 0.0]"
1081,B0028PDGQA,A1Y3B0IGSIJS7E,"Anthony Loffredo ""Milliemouse""",0,0,5,1262476800,Enjoyable Green Tea,"I have been drinking this green tea for sometime and was purchasing it when I was going to Syracuse every summer.  This year I stopped going there and didn't know where I was going to buy my tea until I spotted it on Amazon and purchased it.  I was so pleased  that I could get it, so I am now a happy camper once again.",drinking green tea sometime purchasing going syracuse every summer year stopped going didnt know going buy tea spotted amazon purchased pleased could get happy camper,0.366666667,"[0.0, 0.0, 0.0, 0.0, 0.0, 0.0, 0.0, 0.0, 0.0, 0.0]"
1082,B0028PDGQA,A1MPZHCGA5OX6B,V. Kocan,0,0,5,1251849600,Excellent,"This is the real deal. Genmai Cha. Loose green tea and roasted brown rice. Not in bags. Originally known as the ""Peoples Tea"" for those who couldn't afford better. Very popular because of its mild flavor. You can drink it all day long (like I do). You won't be disappointed.",real deal genmai cha loose green tea roasted brown rice bag originally known people tea couldnt afford better popular mild flavor drink day long like wont disappointed,0.103490028,"[0.0, 0.0, 0.7596380555061503, 0.0, 0.0, 0.6503460806577026, 0.0, 0.0, 0.0, 0.0]"
1083,B003UY9GTE,A2R6RA8FRBS608,Matthew G. Sherwin,2,2,5,1306540800,an excellent alternative to regular Gatorade,"Gatorade G2 is the way to go when you want the benefits of Gatorade without quite so much sugar. As I am in a ""pre-diabetes"" state these days, I am drinking this type of Gatorade instead of the regular Gatorade which has noticeably more sugar in it. The really good thing is that this still replenishes carbs and electrolytes after I exercise without putting unnecessary extra sugar into my system.<br /><br />G2 comes in flavors including fruit punch and grape.<br /><br />If you're on the go, the advantage of these bottles of Gatorade is this: because the bottles are smaller you can carry them with you much easier than if you took the regular, larger size bottles of Gatorade G2.<br /><br />I highly recommend this drink if you need extra carbs or electrolytes after exercising; it replenishes them very well without the extra sugar found in regular Gatorade.",gatorade g way go want benefit gatorade without quite much sugar prediabetes state day drinking type gatorade instead regular gatorade noticeably sugar really good thing still replenishes carbs electrolyte exercise without putting unnecessary extra sugar systembr br g come flavor including fruit punch grapebr br youre go advantage bottle gatorade bottle smaller carry much easier took regular larger size bottle gatorade gbr br highly recommend drink need extra carbs electrolyte exercising replenishes well without extra sugar found regular gatorade,0.066153846,"[0.9182229014260823, 0.0, 0.291238896477086, 0.2684149930154352, 0.0, 0.0, 0.0, 0.0, 0.0, 0.0]"
