1343,B000ODRY9I,A3ULMCBO9WAN2L,"Jennifer Jackson ""bargain hunter""",3,3,5,1221091200,Instant Favorite!,"This dressing became an instant favorite of mine.  It's fat free without losing the flavor.  Alot of other dresings lose alot of flavor in their fat free versions, and that only makes you have to use twice as much.  Wish Bone is now my only choice for Ranch dressing.  My husband doesn't usually go for fat free or diet anything, but I put this on our salads and he didnt even know!",dressing became instant favorite mine fat free without losing flavor alot dresings lose alot flavor fat free version make use twice much wish bone choice ranch dressing husband doesnt usually go fat free diet anything put salad didnt even know,0.235714286,"[0.0, 0.0, 1.0, 0.0, 0.0, 0.0, 0.0, 0.0, 0.0, 0.0]"
1344,B000ODRY9I,A2H92JBMYI97KA,"David C. Becker ""ScubaDaveTX""",1,1,5,1259539200,Thick and creamy; nice flavor,"If I had not purchased this salad dressing myself, I never would have guessed it was fat free. Served it with fresh vegetables during Thanksgiving pre-dinner, and it was a definite hit with the guests too.",purchased salad dressing never would guessed fat free served fresh vegetable thanksgiving predinner definite hit guest,0.233333333,"[0.0, 0.0, 0.0, 0.0, 0.0, 0.0, 0.0, 0.0, 0.0, 0.0]"
1345,B000ODRY9I,A3F9CMU8KNAY1M,"Susan ""minniesm""",1,1,5,1214611200,Good dressing,"Like the flavor and it's thick, unlike some fat free dressings that are really runny.",like flavor thick unlike fat free dressing really runny,0.1,"[0.0, 0.0, 0.7596380555061503, 0.0, 0.0, 0.6503460806577026, 0.0, 0.0, 0.0, 0.0]"
1346,B000ODRY9I,A1PRJJ5NR4VTAK,"Jan Day ""longendlesstunnel""",1,1,5,1206403200,Wish bone Fat Free Ranch Dressing,"<a href=""http://www.amazon.com/gp/product/B000ODRY9I"">Wish Bone Fat Free Ranch Salad Dressing, 16-Ounce Bottle (Pack of 6)</a><br /><br />This is a great salad dressing...tastes just as good and is as flavorful as the regular 'fatfull' dressing.",href bone fat free ranch salad dressing ounce bottle pack abr br great salad dressingtastes good flavorful regular fatfull dressing,0.475,"[0.617262059727639, 0.0, 0.0, 0.5413142860840253, 0.5709346664042522, 0.0, 0.0, 0.0, 0.0, 0.0]"
1347,B000ODRY9I,A1Z5TMUGWOQ1Z5,Joe,0,0,5,1340323200,Its GOOD!!!,The price is pretty good given that local stores sell one bottle for almost $4. Don't know why the price on this has gone up though.,price pretty good given local store sell one bottle almost dont know price gone though,0.316666667,"[0.0, 0.0, 0.0, 0.6913921503135283, 0.0, 0.0, 0.0, 0.7224796844789723, 0.0, 0.0]"
1348,B000ODRY9I,AX5JZLRL9KN9B,"C. G. Persson ""Chris...always a seeker.""",0,0,5,1319068800,"Good price, good product",My doc has strictly limited me on what I can and cannot eat. I can use this salad dressing and was pleased to find it in bulk at a great price. Good taste.,doc strictly limited cannot eat use salad dressing pleased find bulk great price good taste,0.482142857,"[0.0, 0.0, 0.0, 0.5672568347043297, 0.5982967751144415, 0.0, 0.0, 0.0, 0.0, 0.5659157643756567]"
1349,B000ODRY9I,A21VIUWL12CNEL,"vincy ""Vincy""",1,2,1,1322438400,"Sorry, taste is not pleasing.","I bought this for my husband since he loves Ranch. He uses ranch dressing with everything. Before I bought it, I read a review that said it taste good inspite of the fat-free... Well, my husband had it and says it's aweful. I guess ""to each his own"" everyone's tastebuds are not alike.  Someone else may like it, so I am not going to discourage anyone from trying it. However, I had to cancel my subscription because the only one that likes Ranch in the family, doesn't like this one. I guess he needs the fat:)",bought husband since love ranch us ranch dressing everything bought read review said taste good inspite fatfree well husband say aweful guess everyones tastebud alike someone else may like going discourage anyone trying however cancel subscription one like ranch family doesnt like one guess need fat,0.6,"[0.0, 0.0, 0.0, 0.25617470689079064, 0.0, 0.713900888649998, 0.2697512814488858, 0.535386527955292, 0.0, 0.25556907593608064]"
1350,B000ODRY9I,A2QOP0L8VG843A,"Catherine A. Sullivan ""Catherine,Serene Butte...",1,2,5,1207612800,GREAT FAT FREE RANCH,WANT TO TASTE SOMETHING DIFFERENT?  THEN YOU ARE COMING TO THE RIGHT PLACE.  I JUST LOVE THE SMOOTHNESS  AND FLAVOR OF THE RANCH DRESSINGNOW GET ON YOUR HORSES (OR MULES) AND ORDER SOME TODAY.,want taste something different coming right place love smoothness flavor ranch dressingnow get horse mule order today,0.261904762,"[0.0, 0.0, 0.5989832022696079, 0.0, 0.0, 0.0, 0.5812986385759207, 0.0, 0.0, 0.5507367939303014]"
1351,B001JTCPE0,ALIU1R2MJQ53F,LM,0,0,5,1271808000,Delicious tea- slight hints of almond and chocolate but not overpowering,"This is a very smooth tea from Argo Tea.  I was so excited when they came to NYC, and I bought a bag of this tea to make at home.  It has an almondy/chocolatey flavor (but not overpowering).  It's a great tea for everyone, including people just starting to drink tea.  I love it in a Latte (I just microwave some milk and use that instead of water).",smooth tea argo tea excited came nyc bought bag tea make home almondychocolatey flavor overpowering great tea everyone including people starting drink tea love latte microwave milk use instead water,0.415,"[0.0, 0.0, 0.5885684551970207, 0.0, 0.5721254943771152, 0.0, 0.5711913796887467, 0.0, 0.0, 0.0]"
1352,B003Y0ZJUE,A1N0AEOEZV7ZWM,Jasmine Pearl  Lover,0,0,5,1349395200,Great for multi-infusion.. Jasmine Dragon Pearl Green TEA,"If you like jasmine tea, This is a great tea! Its lite not, overly medicine tasting like jasmine tea can be. Its also fun to watch the tea leaves unfurl... I steep it so many times that until I lost count.. haha. Just Great .",like jasmine tea great tea lite overly medicine tasting like jasmine tea also fun watch tea leaf unfurl steep many time lost count haha great,0.52,"[0.0, 0.0, 0.0, 0.0, 0.7504412326584977, 0.6609371803174597, 0.0, 0.0, 0.0, 0.0]"
1353,B0046HFHD8,A36JCWHDZW0JXY,"James McGillivray ""Blueskier""",3,3,5,1323302400,Darn Good!,We received a box of these at work and the whole package was gone moments after opening it up!  Great biscuits and now I am ordering a couple boxes for a few gifts for people I can't figure out what to get...,received box work whole package gone moment opening great biscuit ordering couple box gift people cant figure get,0.5,"[0.0, 0.0, 0.0, 0.0, 1.0, 0.0, 0.0, 0.0, 0.0, 0.0]"
1354,B0046HFHD8,A1B40VHNFY129X,Curt U,0,0,3,1326758400,Difficult to review.,"I sent this product to my brother in law, so I have never seen the product and know nothing about it.  All I heard from him was that he was not impressed.  Other than that, I can say that it was delivered.  I ordered two of these going to different addresses and we got immediate feedback on the first one, but until we spoke to my brother in law, we had no idea if the product had even been shipped.  Would I order again?  Probably not...<br /><br />Thanks anyway,<br />Curt U",sent product brother law never seen product know nothing heard impressed say delivered ordered two going different address got immediate feedback first one spoke brother law idea product even shipped would order probably notbr br thanks anywaybr curt u,0.3625,"[0.3155519464947852, 0.0, 0.0, 0.0, 0.0, 0.0, 0.0, 0.28916915360296513, 0.903774401976454, 0.0]"
1355,B005151BV6,A22LUAIE4SMPGZ,Margaux,2,2,5,1318118400,Yummy!,"Of all the flavors of tic tacs, these are my favorite.  Great wild cherry flavor. Love them!! Too bad they aren't more readily available to purchase locally.",flavor tic tacs favorite great wild cherry flavor love bad arent readily available purchase locally,0.228571429,"[0.0, 0.0, 0.8243145562775757, 0.0, 0.4006427535049347, 0.0, 0.3999886203042375, 0.0, 0.0, 0.0]"
1356,B005151BV6,A3OE43295RWN74,P. Meyers,2,2,5,1314316800,Great product and good price,"These little buggers are tough to find so I was happy to get a big pack at a good price online.  My daughter is content with these as a reward for doing something well and at 2 calories a piece, not all that unhealthy.",little bugger tough find happy get big pack good price online daughter content reward something well calorie piece unhealthy,0.087268519,"[0.0, 0.0, 0.0, 1.0, 0.0, 0.0, 0.0, 0.0, 0.0, 0.0]"
1357,B005151BV6,A3OK0COYMR9WUK,"Educator Mom ""Educator Mom""",1,1,5,1330473600,"Great flavor, shipped fast",Definitely would reorder these again.  I think it would be better if they were offered in a bigger pack.  My kids love these.  Great little Valentine's Day gifts.  Great stocking stuffers.,definitely would reorder think would better offered bigger pack kid love great little valentine day gift great stocking stuffer,0.344642857,"[0.0, 0.0, 0.0, 0.0, 0.8947191634131205, 0.0, 0.4466291735000365, 0.0, 0.0, 0.0]"
1358,B005151BV6,A1ZP3UHZXPLJ0U,soccerkayak,1,1,5,1325894400,Delicious and hard to find,"I bought them for a friend because she loves the cherry ones and they're hard to find. I kept half for myself. I admit, gone in no time.",bought friend love cherry one theyre hard find kept half admit gone time,0.013888889,"[0.0, 0.0, 0.0, 0.0, 0.0, 0.0, 0.7098092762393592, 0.7043939177509677, 0.0, 0.0]"
1359,B005151BV6,A3JV57W80SI5MX,"Julian P. Huff ""Julian Huff""",1,1,5,1325808000,Tic-Tac-Yum!,"Everyone knows what a Tic Tac is, but let me tell you something; if you like orange tic tac's, you're going to LOVE wild cherry tic tacs!  Very cherry flavored with just enough of a mix of sweet and sour.  Do yourself a favor and try some.",everyone know tic tac let tell something like orange tic tacs youre going love wild cherry tic tacs cherry flavored enough mix sweet sour favor try,0.16,"[0.0, 0.0, 0.0, 0.0, 0.0, 0.6615452408005005, 0.7499052569319726, 0.0, 0.0, 0.0]"
1360,B005151BV6,AD6KPEXEHEH5N,Shoe lover,1,1,5,1324512000,Great tasting little treats,I love these Wild Cherry Tic Tacs and they are impossible to find in stores.  I am so glad that I can get them from Amazon and the price is excellent!  They are a great low calorie treat and I will keep buying them from Amazon.  Highly recommend this purchase!,love wild cherry tic tacs impossible find store glad get amazon price excellent great low calorie treat keep buying amazon highly recommend purchase,0.299166667,"[0.0, 0.0, 0.0, 0.0, 0.7076842665679848, 0.0, 0.7065288237942832, 0.0, 0.0, 0.0]"
1361,B005151BV6,A133OLJFP564T1,Snowman,0,0,4,1340409600,Good,I low orange tictacs and after reading reviews I decided to try these and there almost just as good. Orange is still my favorite but cherry is pretty close,low orange tictac reading review decided try almost good orange still favorite cherry pretty close,0.3625,"[0.0, 0.0, 0.0, 1.0, 0.0, 0.0, 0.0, 0.0, 0.0, 0.0]"
1362,B005151BV6,A1HOXKR7OKJ1X1,"L. R. Dana-kirby ""Leslie Dana Kirby""",0,0,5,1339372800,Cherry good!,"These are one of my favorite flavors of tic tacs.  The flavor is a true sour cherry and quite intense.  You really get a lot of flavor out of one 2-calorie treat, which can satisfy for quite a while!",one favorite flavor tic tacs flavor true sour cherry quite intense really get lot flavor one calorie treat satisfy quite,0.22,"[0.0, 0.0, 0.8414881483006065, 0.0, 0.0, 0.0, 0.0, 0.5402755743781281, 0.0, 0.0]"
1363,B005151BV6,A2CFWPZX3VUF64,"Benjamin R. Tyler ""Ben Jamin""",0,0,5,1327104000,tic tac,great thanks for the great service i don't know what else to say i have said all i have tu say.,great thanks great service dont know else say said tu say,0.6,"[0.0, 0.0, 0.0, 0.0, 1.0, 0.0, 0.0, 0.0, 0.0, 0.0]"
1364,B005151BV6,AUFES5GU717KT,L. LeRoy,0,0,4,1322179200,tic tac solution,"Since husband quit smoking many many yrs ago, he took up the tic-tac habit with cinnamon tic-tacs.  they no longer make cinnamon so he has tried the wild cherry and they are OK.",since husband quit smoking many many yr ago took tictac habit cinnamon tictac longer make cinnamon tried wild cherry ok,0.4,"[0.0, 0.0, 0.0, 0.0, 0.0, 0.0, 0.0, 0.0, 0.0, 0.0]"
1365,B0006GWXYY,A1BMZEA51ZR6JD,"L. Roy ""Malone Alum""",1,1,5,1206662400,easter basket,Very nice product<br />full of quality items - not the cheap candies like other baskets,nice productbr full quality item cheap candy like basket,0.45,"[0.0, 0.0, 0.0, 0.0, 0.0, 1.0, 0.0, 0.0, 0.0, 0.0]"
1366,B007KDXVII,A2MFQXDIPFDXGX,"Daniel J. Harp ""DJ""",0,0,5,1344556800,Bars,Were just what my wife wanted and she loves them. Next she will get the other type of bar by the same vendor.,wife wanted love next get type bar vendor,0.25,"[0.0, 0.0, 0.0, 0.0, 0.0, 0.0, 1.0, 0.0, 0.0, 0.0]"
1367,B0013JQON4,A2N3BRPS0NS7FF,B. Martinek,12,12,5,1327881600,Another favorite!,"I love sorghum flour.  It's mild in flavor and smell, it's easily mixed into flour blends for gluten free baking too.  It's one of my favorites along with millet, sweet rice, coconut and almond.",love sorghum flour mild flavor smell easily mixed flour blend gluten free baking one favorite along millet sweet rice coconut almond,0.347222222,"[0.0, 0.0, 0.5903502451384133, 0.0, 0.0, 0.0, 0.5729205635176674, 0.5685495721250821, 0.0, 0.0]"
1368,B0013JQON4,AYGJ96W5KQMUJ,SJP,6,6,5,1330992000,Good flour for gluten-free baking,"I buy most of my flours from Bob's Red Mill in the 4-pack boxes, if only because having all the bags and boxes the same size makes it easier to store them.  It's good flour, and the bag's a good size for baking for a small family - also a good shape that will stand up on the counter while you scoop flour out of it.",buy flour bob red mill pack box bag box size make easier store good flour bag good size baking small family also good shape stand counter scoop flour,0.37,"[0.0, 0.0, 0.0, 1.0, 0.0, 0.0, 0.0, 0.0, 0.0, 0.0]"
1369,B0013JQON4,A2A0LMJKSRTKY2,Sherry O'Neal,11,13,5,1295827200,Great for GF Baking,My sister is alergic to wheat so I make her a lot of Gluten Free foods.  I searched local stores and could not find Sorghum Flour.  So I looked on Amazon and finally found it.  It was all packed wonderfully and arrived perfectly fine and I'm already using it.,sister alergic wheat make lot gluten free food searched local store could find sorghum flour looked amazon finally found packed wonderfully arrived perfectly fine im already using,0.363333333,"[0.0, 0.0, 0.0, 0.0, 0.0, 0.0, 0.0, 0.0, 0.0, 0.0]"
1370,B0013JQON4,A2XA2823X5EPKE,Oiaw Gardener,4,4,5,1342137600,Perfect Treat!,"I love baking with The Bob's Red Mill 'Sweet' White Sorghum Flour. I use it in many things but I tend to lean toward sweeter treats such as Cakes and Muffins. I make a crumble topping with this flour that my family and guests beg for! I would highly recommend this flour to any baker, even more for the gluten-intolerant ones. I use normal recipes and just replace the wheat flour. It always turns out fantastic!",love baking bob red mill sweet white sorghum flour use many thing tend lean toward sweeter treat cake muffin make crumble topping flour family guest beg would highly recommend flour baker even glutenintolerant one use normal recipe replace wheat flour always turn fantastic,0.2575,"[0.0, 0.0, 0.0, 0.0, 0.0, 0.0, 0.7098092762393592, 0.7043939177509677, 0.0, 0.0]"
1371,B0013JQON4,A265ZN83B11MSQ,Tabitha,2,2,5,1338076800,Best for Sweets :],I am a big fan of Sorghum flour for my baked goods. It gives everything a bit of sponge (especially cakes) and adds an extra bit of sweet to the baking. I highly recommend this for baking flour mixes - you may not want to add it to savory recipes though because of the light sweet flavor.,big fan sorghum flour baked good give everything bit sponge especially cake add extra bit sweet baking highly recommend baking flour mix may want add savory recipe though light sweet flavor,0.245,"[0.0, 0.0, 0.7353328908446626, 0.6777060864726179, 0.0, 0.0, 0.0, 0.0, 0.0, 0.0]"
1372,B001HTN94C,A1804Z5697O7SX,djin,0,0,4,1316044800,"Spectrum Naturals Walnut Oil, refined","Spectrum Naturals Walnut Oil, refined, is a very mild oil. I can't detect any walnut smell or taste any walnut flavor at all. Maybe that's what you want in some cases, though I was hoping for a more nutty flavor like raw walnuts.<br /><br />It does have the advantage of having higher Omega 3 content than most oils. Also most oils that are high in Omega 3 (like fish oil and flax oil) have a strong taste which you probably don't want on your salad.<br /><br />Unlike some of Spectrum's oils, it is not organic.",spectrum natural walnut oil refined mild oil cant detect walnut smell taste walnut flavor maybe thats want case though hoping nutty flavor like raw walnutsbr br advantage higher omega content oil also oil high omega like fish oil flax oil strong taste probably dont want saladbr br unlike spectrum oil organic,0.174316239,"[0.5476301383209625, 0.0, 0.5210865365517033, 0.0, 0.0, 0.4461158630396621, 0.0, 0.0, 0.0, 0.47911448503618775]"
1373,B00068PCTU,A25XCB9AMF34AE,George Garber,7,7,5,1141862400,White Stevia 12 Oz Pwdr,Great product!<br /><br />The Stevia powder will not raise your blood glucose level and it is all natural.<br /><br />Use very sparingly since it is much sweeter than sugar.<br /><br />Tastes more natural than artifical sweeteners and is healthy to use since it is an organic natural sweetener.,great productbr br stevia powder raise blood glucose level naturalbr br use sparingly since much sweeter sugarbr br taste natural artifical sweetener healthy use since organic natural sweetener,0.34,"[0.9205332671343452, 0.0, 0.0, 0.0, 0.2838148160373807, 0.0, 0.0, 0.0, 0.0, 0.2684541940380816]"
1374,B00068PCTU,A15YB0DWQ815SY,"Susan Schenck ""award-winning author of two books""",6,6,5,1265846400,"Great taste, safe & Natural","I have recently been on a low carb diet, as I find that I can no longer tolerate even natural sugars like agave, honey, and dates. These raise the blood sugar which spikes the insulin, a hormone whose message is ""store fat!"" Insulin also causes the kidneys to retain water and therefore I would bloat from a high carb diet.<br /><br />My dilemma is that I love sweets--and now it is not a problem, thanks to products like stevia, a natural plant that has safely been used in parts of the world as a sweetener for hundreds of years. It has no calories and no impact on the blood sugar (although for some people there might be a bit, as the brain is tricked into thinking it is getting sugar). Stevia used to be legal in the USA only as a cosmetic product because of politics: companies that made low calorie sweeteners such as aspartame did not want competition. Yet, aspartame gave me headaches and even sometimes symptoms of multiple sclerosis. So I would use stevia at times, but the aftertaste was bad--and to be honest, I wasn't too crazy about the ""during taste"" either.<br /><br />Then I tried NuNaturals. This product is awesome and like no other stevia I have tried. It is not only delicious but also has no aftertaste (unless you put in way too much--a common mistake by people new to this). It comes in tablets and in powdered form (in a bottle or handy packets with individual servings). It also comes in alcohol-free liquid form and even in vanilla flavor. Unlike aspartame (which becomes even more toxic when heated) stevia can be used in baking. NuNaturals has a stevia baking blend just for that. (Since I am a raw fooder, I can't tell you how it tastes, but I am sure it is good, judging by their other products.)<br /><br />Thanks to these great products, I can do a low carb raw diet but not be deprived of my sweets!",recently low carb diet find longer tolerate even natural sugar like agave honey date raise blood sugar spike insulin hormone whose message store fat insulin also cause kidney retain water therefore would bloat high carb dietbr br dilemma love sweetsand problem thanks product like stevia natural plant safely used part world sweetener hundred year calorie impact blood sugar although people might bit brain tricked thinking getting sugar stevia used legal usa cosmetic product politics company made low calorie sweetener aspartame want competition yet aspartame gave headache even sometimes symptom multiple sclerosis would use stevia time aftertaste badand honest wasnt crazy taste eitherbr br tried nunaturals product awesome like stevia tried delicious also aftertaste unless put way mucha common mistake people new come tablet powdered form bottle handy packet individual serving also come alcoholfree liquid form even vanilla flavor unlike aspartame becomes even toxic heated stevia used baking nunaturals stevia baking blend since raw fooder cant tell taste sure good judging productsbr br thanks great product low carb raw diet deprived sweet,0.241724045,"[0.49999766182479466, 0.0, 0.15858760116396298, 0.14615935705589667, 0.1541571059693319, 0.40731302536904784, 0.15390541220910345, 0.0, 0.6364651495049088, 0.291627633934301]"
1375,B00068PCTU,A1ESKQMRVT5AAR,Joel Grant,2,2,3,1345420800,"Only 6.4% Stevia Extract, but very good flavor","I have mixed feelings about NuNaturals Nustevia White Stevia with Maltodextrin Powder and will probably not purchase it again.  Don't get me wrong, it's a great tasting stevia extract and very easy to use, but it is just 6.4 percent stevia and 93.6 percent maltodextrin filler.  In other words only 6 pennies of each dollar you spend on this stuff is buying you high quality stevia extract powder.  In my opinion, this is unnecessarily dilute; however, it does make it exceptionally easy to measure.  If the labeling said 6.4% stevia extract, I would have passed on this from the beginning as I can get 70% dry stevia extract of the same quality for much less money per serving of stevia. If this is your first time buying stevia, go for it as it's easy to use and tastes great.  If you're accustomed to buying and using concentrated stevia extracts, you will be probably be disappointed by the low concentration of this product's mixture.<br /><br />Pros:<br />- 5-star taste<br />- Easy to measure<br />- Perfect for first-time stevia users<br />- 3/4 tsp = ~1 tbsp cane sugar<br /><br />Cons<br />- Only 6.4% stevia<br />- Not cost-competitive with 70% or pure dry stevia extracts<br />- 3/4 tsp = ~1 tbsp cane sugar<br /><br />Overall, a good product but not the best value.  I would given it 4 stars if the product labeling didn't try to hide the fact that it's just not very potent.  For about 1/3 to 1/2 the cost of this product, you can buy concentrated stevia powders and cut them yourself with a low-cost filler like maltodextrin and come out ahead (or just use them full strength, which is often easier once you get used to the sweetening power of pure stevia).<br /><br />In case you're wondering where I got the 6.4% (by mass) value from, this is how I calculated it.  On a precise scale, I found the density of this product to be 2.5 grams per teaspoon.  The label says it contains 40mg per 1/4 tsp.  Thus, 1 tsp has 160mg stevia extract in 2500mg mixed powder.  The concentration (mass) comes to 64mg stevia per gram of product or 6.4 percent by weight.  Pretty weak stuff, but still much sweeter than cane sugar.",mixed feeling nunaturals nustevia white stevia maltodextrin powder probably purchase dont get wrong great tasting stevia extract easy use percent stevia percent maltodextrin filler word penny dollar spend stuff buying high quality stevia extract powder opinion unnecessarily dilute however make exceptionally easy measure labeling said stevia extract would passed beginning get dry stevia extract quality much le money per serving stevia first time buying stevia go easy use taste great youre accustomed buying using concentrated stevia extract probably disappointed low concentration product mixturebr br prosbr star tastebr easy measurebr perfect firsttime stevia usersbr tsp tbsp cane sugarbr br consbr steviabr costcompetitive pure dry stevia extractsbr tsp tbsp cane sugarbr br overall good product best value would given star product labeling didnt try hide fact potent cost product buy concentrated stevia powder cut lowcost filler like maltodextrin come ahead use full strength often easier get used sweetening power pure steviabr br case youre wondering got mass value calculated precise scale found density product gram per teaspoon label say contains mg per tsp thus tsp mg stevia extract mg mixed powder concentration mass come mg stevia per gram product percent weight pretty weak stuff still much sweeter cane sugar,0.220452381,"[0.5421635121832991, 0.0, 0.0, 0.11886396138935136, 0.2507362465315875, 0.11041564653829813, 0.0, 0.0, 0.7764070376365317, 0.11858295123307729]"
1376,B00068PCTU,A4WQ5WJZMLUQG,"John ""John""",2,2,5,1317340800,My new favorite sweetener,"I used to use agave nectar and honey. Even though I picked organic, there was still more sugar than desired after I put in my recipes. I actually got Tinea Versicolor due to the sugars in those products.<br /><br />But this product is great. I use it in my protein shakes, smoothies, and baking recipes (muffins, breads), and it's awesome.<br /><br />I make a chocolate milkshake and this stuff really rounds off the edges:<br />- Cottage Cheese<br />- Chocolate Protein Powder<br />- Cacao powder<br />- Almond Milk<br />- Nustevia powder<br /><br />Just need maybe 1/4 cup of each ingredient and 1 cup of almond milk and it takes just like a sugary chocolate milk shake.",used use agave nectar honey even though picked organic still sugar desired put recipe actually got tinea versicolor due sugar productsbr br product great use protein shake smoothy baking recipe muffin bread awesomebr br make chocolate milkshake stuff really round edgesbr cottage cheesebr chocolate protein powderbr cacao powderbr almond milkbr nustevia powderbr br need maybe cup ingredient cup almond milk take like sugary chocolate milk shake,0.11875,"[0.8873330276397432, 0.0, 0.0, 0.0, 0.2735786624935867, 0.24094932676203032, 0.0, 0.0, 0.28237959455461925, 0.0]"
